{
  "$schema": "./planning-step-seed.schema.json",
  "documentType": "planning-step-seed",
  "schemaVersion": 1,
  "revision": "Z0104V40",
  "status": "NON_EXECUTABLE_PENDING_CANONICAL_BINDING",
  "variants": [
    "rpi4",
    "rpi5",
    "rpi-zero-2-w"
  ],
  "instructionSource": "owner photographs 04, 05, 06; quantities transcribed from printed depictions",
  "steps": [
    {
      "id": "PX-V40-STEP-01",
      "printedNumber": 1,
      "title": "Prepare Plate A mounting supports",
      "evidenceRef": "PX-EV-PHOTO-04",
      "sourcePanel": "printed step 1",
      "prerequisites": [],
      "parentAssemblies": "base/electronics",
      "introducedParts": "Plate A ×1. Pi4/Pi5: M2.5x18+6 nylon standoff ×4. Zero2W: M2.5x30 ×2 and M2.5x11 ×2.",
      "introducedHardware": "M2.5x6 screw ×4 for every branch.",
      "connectionIntent": "Plate-A rear-deck mounting holes -> screw bearing stack -> standoff base faces; all standoff axes normal to the mounting plane. Four physical support positions; branch chooses support types.",
      "finalConstraintStatus": "UNRESOLVED_NUMERICAL_INTERFACES",
      "orientation": "Keep the male ends of the Pi4/Pi5 M2.5x18+6 supports toward the Pi. For Zero2W distinguish the two tall HAT supports from the two short Pi supports; do not mirror the diagram.",
      "tools": "Matched screwdriver; hand placement of nylon standoffs. Driver size/torque unresolved.",
      "cableOperations": "None. Power remains off.",
      "zeroingRequirements": "None.",
      "cameraIntent": "Rear deck, underside screw view then top support view.",
      "motionIntent": "Stage A as workpiece; align each screw/support to its named hole axis; seat according to the evidenced stack. No dimensional animation before admission.",
      "verificationChecks": "Correct four positions and branch-specific support types; zero duplicated hardware; support axes and bearing contacts pass when geometry exists.",
      "geometryBlockerIds": [
        "Q-03",
        "Q-06",
        "Q-10"
      ],
      "variantDetails": {
        "rpi4": "4× M2.5x18+6",
        "rpi5": "4× M2.5x18+6",
        "rpi-zero-2-w": "2× M2.5x30 + 2× M2.5x11"
      },
      "confidence": "VERIFIED",
      "confidenceScope": "printed instruction transcription; not dimensional or physical verification"
    },
    {
      "id": "PX-V40-STEP-02",
      "printedNumber": 2,
      "title": "Mount the selected Raspberry Pi",
      "evidenceRef": "PX-EV-PHOTO-04",
      "sourcePanel": "printed step 2",
      "prerequisites": [
        "PX-V40-STEP-01"
      ],
      "parentAssemblies": "base/electronics",
      "introducedParts": "Selected Raspberry Pi ×1, user-supplied. Pi4/Pi5: M2.5x18 standoff ×4; USB mini microphone ×1 shown in the shared panel. Zero2W: M2.5x18+6 standoff ×2.",
      "introducedHardware": "No additional separate screw is prescribed in this panel; upper standoffs fasten the board.",
      "connectionIntent": "Pi mounting holes -> step-1 supports; upper standoff bearing faces clamp the selected board. Zero2W uses two short support positions, leaving tall HAT supports available.",
      "finalConstraintStatus": "UNRESOLVED_NUMERICAL_INTERFACES",
      "orientation": "GPIO header and camera connector must match the selected board orientation. Microphone insertion follows the matching board USB port; Zero2W USB adaptation is not prescribed here.",
      "tools": "Hand fastening/matched tool if needed; no guessed torque.",
      "cableOperations": "Pi4/Pi5 USB mini microphone plug shown. Zero2W microphone remains an accounted accessory until an applicable adapter procedure exists.",
      "zeroingRequirements": "None.",
      "cameraIntent": "Rear-deck oblique with GPIO/camera connector labels.",
      "motionIntent": "Board approaches along support axes, seats on bearing faces, then upper standoffs install. USB accessory is a separate child operation.",
      "verificationChecks": "Board identity/branch; GPIO/header availability; correct support stack; no port collision; microphone disposition accounted.",
      "geometryBlockerIds": [
        "Q-03",
        "Q-06",
        "Q-10",
        "Q-14"
      ],
      "variantDetails": {
        "rpi4": "Pi4; 4× M2.5x18; USB microphone panel",
        "rpi5": "Pi5; 4× M2.5x18; USB microphone panel",
        "rpi-zero-2-w": "Zero2W; 2× M2.5x18+6; header readiness required"
      },
      "confidence": "VERIFIED",
      "confidenceScope": "printed instruction transcription; not dimensional or physical verification"
    },
    {
      "id": "PX-V40-STEP-03",
      "printedNumber": 3,
      "title": "Connect the Pi end of the camera ribbon",
      "evidenceRef": "PX-EV-PHOTO-04",
      "sourcePanel": "printed step 3",
      "prerequisites": [
        "PX-V40-STEP-02"
      ],
      "parentAssemblies": "base/electronics",
      "introducedParts": "One selected camera ribbon: Pi4 FFC; Pi5/Zero2W FPC. Alternative cable stock remains noninstalled.",
      "introducedHardware": "None.",
      "connectionIntent": "Selected cable Pi-end -> selected Pi camera connector; latch open/insertion/latch closed are separate presentation phases of one atomic connection operation. Camera end remains free.",
      "finalConstraintStatus": "UNRESOLVED_NUMERICAL_INTERFACES",
      "orientation": "Use the exact printed contact/stiffener orientation for that board connector; do not generalize a screen-space “blue side up”.",
      "tools": "Hands; do not force latch.",
      "cableOperations": "Connect Pi end only, power OFF. Cable length/pitch and board-port identity need applicable source binding.",
      "zeroingRequirements": "None.",
      "cameraIntent": "Connector-normal macro view and source inset.",
      "motionIntent": "Latch opens; approved ribbon end aligns/inserts; latch closes. Unknown flex shape uses schematic line.",
      "verificationChecks": "Selected cable label; correct connector face; power-off acknowledgment; camera-end still disconnected.",
      "geometryBlockerIds": [
        "Q-09",
        "Q-10"
      ],
      "variantDetails": {
        "rpi4": "FFC",
        "rpi5": "FPC",
        "rpi-zero-2-w": "FPC"
      },
      "confidence": "VERIFIED",
      "confidenceScope": "printed instruction transcription; not dimensional or physical verification"
    },
    {
      "id": "PX-V40-STEP-04",
      "printedNumber": 4,
      "title": "Mount the Robot HAT",
      "evidenceRef": "PX-EV-PHOTO-04",
      "sourcePanel": "printed step 4",
      "prerequisites": [
        "PX-V40-STEP-03"
      ],
      "parentAssemblies": "base/electronics",
      "introducedParts": "Robot HAT ×1.",
      "introducedHardware": "M2.5x6 screw ×4 in all three branches; fourth screw confirmed by legibility crops.",
      "connectionIntent": "HAT GPIO connector -> Pi header; HAT holes -> four prepared support positions; screw bearing faces -> HAT/support stack.",
      "finalConstraintStatus": "UNRESOLVED_NUMERICAL_INTERFACES",
      "orientation": "No shifted GPIO engagement; preserve the camera-ribbon route under/around the board as illustrated. A ZERO-button-capable depiction does not identify actual HAT revision.",
      "tools": "Matched screwdriver.",
      "cableOperations": "Camera ribbon already connected at Pi; keep clear of trapped edges. Power OFF.",
      "zeroingRequirements": "None.",
      "cameraIntent": "Top-oblique HAT/header alignment and side stack view.",
      "motionIntent": "HAT approaches along GPIO/support axes; seat connector and mounting stack; four individually tracked screws install.",
      "verificationChecks": "Four screw instances and supports; header keying/position; HAT revision applicability; no trapped ribbon or connector interference.",
      "geometryBlockerIds": [
        "Q-03",
        "Q-06",
        "Q-07",
        "Q-09",
        "Q-10"
      ],
      "variantDetails": {},
      "confidence": "VERIFIED",
      "confidenceScope": "printed instruction transcription; not dimensional or physical verification"
    },
    {
      "id": "PX-V40-STEP-05",
      "printedNumber": 5,
      "title": "Install the two drive motors",
      "evidenceRef": "PX-EV-PHOTO-04",
      "sourcePanel": "printed step 5",
      "prerequisites": [
        "PX-V40-STEP-04"
      ],
      "parentAssemblies": "drive/base",
      "introducedParts": "TT motor ×2; separate left/right role instances.",
      "introducedHardware": "M3x25 screw ×4; spring washer ×4; M3 nut ×4.",
      "connectionIntent": "Each motor mounting interface -> Plate A rear side-wall holes through the exact screw/washer/nut stack. Shaft interfaces remain available for rear wheels.",
      "finalConstraintStatus": "UNRESOLVED_NUMERICAL_INTERFACES",
      "orientation": "Motor wires face inward, as explicitly printed. Robot left/right, not viewer left/right, names the role.",
      "tools": "Matched screwdriver and kit wrench; no assumed wrench size or torque.",
      "cableOperations": "Integrated motor leads are owned by their motor instances and remain unattached at the HAT.",
      "zeroingRequirements": "None.",
      "cameraIntent": "Underside rear drivetrain, then each mounting side.",
      "motionIntent": "Motors align to mount axes; fasteners approach from illustrated access sides and seat in ordered stacks.",
      "verificationChecks": "Correct inward lead exit; four complete fastener stacks; motor/shaft handed placement; unused HAT endpoints until S29.",
      "geometryBlockerIds": [
        "Q-03",
        "Q-04",
        "Q-06"
      ],
      "variantDetails": {},
      "confidence": "VERIFIED",
      "confidenceScope": "printed instruction transcription; not dimensional or physical verification"
    },
    {
      "id": "PX-V40-STEP-06",
      "printedNumber": 6,
      "title": "Prepare battery hook-and-loop mounting",
      "evidenceRef": "PX-EV-PHOTO-05",
      "sourcePanel": "printed step 6",
      "prerequisites": [
        "PX-V40-STEP-05"
      ],
      "parentAssemblies": "drive/base",